{"schema_version":1,"id":"alternate","role":"alternate","model_family":"qwen3.5","filename":"Qwen3.5-27B-Q8_0.gguf","sha256":"0000000000000000000000000000000000000000000000000000000000000000","bytes":1,"source_uri":"https://models.invalid/Qwen3.5-27B-Q8_0.gguf","license":"REPLACE_WITH_UPSTREAM_LICENSE","quantization":"Q8_0","context":131072,"threads":32,"batch":2048,"ubatch":512,"numa":"distribute","min_ram_bytes":51539607552,"sampling":{"temperature":0.2,"top_p":0.95,"top_k":40,"min_p":0.05,"seed":1}}
