{"schema_version":1,"id":"qc","role":"qc","model_family":"mistral-small-4","filename":"Mistral-Small-4-119B-Q5_K_L.gguf","sha256":"0000000000000000000000000000000000000000000000000000000000000000","bytes":1,"source_uri":"https://models.invalid/Mistral-Small-4-119B-Q5_K_L.gguf","license":"REPLACE_WITH_UPSTREAM_LICENSE","quantization":"Q5_K_L","context":65536,"threads":32,"batch":1024,"ubatch":256,"numa":"distribute","min_ram_bytes":103079215104,"sampling":{"temperature":0.1,"top_p":0.9,"top_k":40,"min_p":0.05,"seed":1}}
